{
  "session_id": "550e8400-e29b-41d4-a716-446655440000",
  "client_request_id": "req-1",
  "idempotency_key": "idem-1",
  "registration_id": "550e8400-e29b-41d4-a716-446655440003",
  "input": {
    "messages": [
      {
        "type": "message",
        "role": "user",
        "content": [
          {
            "type": "input_text",
            "text": "hi"
          }
        ]
      }
    ]
  },
  "tools": [
    {
      "name": "search",
      "description": "Search docs",
      "input_schema": {
        "type": "object",
        "properties": {
          "q": {
            "type": "string"
          }
        }
      },
      "host_execution_required": true
    }
  ]
}
